{
  "approved_by": "human",
  "created_at": "2026-01-29T00:00:00Z",
  "hash": "sha256:5dab53ce133235421b932c2fb81a6703472f0e7622af35c480c969b9043be72c",
  "policy_id": "sheratan-phase1-core",
  "rules": [
    {
      "rule_id": "deterministic_mode",
      "severity": "hard",
      "target": "DETERMINISTIC_MODE",
      "type": "require",
      "value": true
    },
    {
      "rule_id": "no_learning",
      "severity": "hard",
      "target": "ENGINE_MUTATES_FROM_OBS",
      "type": "forbid"
    },
    {
      "rule_id": "trace_required",
      "severity": "hard",
      "target": "DECISION_TRACE_ON_TRANSITION",
      "type": "require",
      "value": true
    }
  ],
  "schema_version": "policy_bundle_v1",
  "version": "1.0.0"
}
